<!ELEMENT books (book+)>
        <!ELEMENT book (bookName,author,price)>
        <!ELEMENT bookName (#PCDATA)>
        <!ELEMENT author (#PCDATA)>
        <!ELEMENT price (#PCDATA)>